name,latitude,longitude
"THE TABLE CHURCH, INC.",37.994388,-78.500047
CHURCH SPIRITS LLC,38.861228,-77.151766
RIVERS UNITED CHURCH,36.776633,-76.843397
DIAMOND HILL PRESBYTERIAN CHURCH,37.200596,-79.044767
REVIVAL CHURCH,39.128732,-77.54611
RELENTLESS CHURCH,36.80965,-76.204265
RESURRECTION CHURCH,36.764021,-80.736139
REBIRTH CHURCH LLC,37.467053,-77.534123
PROCEEDING WORD CHURCH VA,36.735452,-76.367804
"WILLIAMSBURG PRESBYTERIAN CHURCH, INC.",37.272546,-76.709681
PILLAR CHURCH SBC,36.711675,-76.258561
CHURCH OF THE WAY,38.087392,-78.939613
THE WELL CHURCH OF VIRGINIA,37.099641,-76.532154
CHURCH OF THE WARRIOR SPIRIT CORP.,36.865219,-75.981209
"WESTMINSTER PRESBYTERIAN CHURCH OF WAYNESBORO, VIRGINIA, INC.",38.072943,-78.91186
THE REMNANT CHURCH OF POWER INC.,36.580749,-79.391555
"PLACE OF REDEMPTION CHURCH, INC.",36.805239,-76.362362
PERSIAN CHURCH OF VIRGINIA,38.80783,-77.183722
OASIS CHURCH RICHMOND,37.618656,-77.452066
"NEW VALLEY CHURCH, INC.",38.081796,-78.930905
"ROCK CHURCH OF NEWPORT NEWS, INC.",37.121524,-76.532087
"CHURCH OF NEW VISION, LLC",37.766365,-76.559352
"MOVEMENT CHURCH, INC.",38.074362,-78.458109
"MIDDLETOWN PRESBYTERIAN CHURCH, INC.",39.174154,-78.121064
MANIFEST CHURCH INC.,37.610948,-77.438747
"MOSAIC CHURCH LYNCHBURG, INC.",37.404391,-79.171343
"ST. MATTHEW S LUTHERAN CHURCH OF WOODBRIDGE , VIRGINIA",38.685167,-77.308648
THE LOVE CHURCH MINISTRIES,37.519916,-77.443852
LOVE CHURCH,38.794378,-77.620573
LIVINGDAY CHURCH,38.62496,-77.376632
LIMITLESS CHURCH INC.,37.31945,-79.959083
"OCEAN VIEW LIGHTHOUSE CHURCH, INC.",36.940923,-76.256424
"WASHINGTON TREE OF LIFE CHURCH, INC.",38.855717,-77.317642
TREE OF LIFE CHURCH,38.829218,-77.199658
"VIRGINIA NEW LIFE CHURCH, INC.",38.840717,-77.406121
MARANATHA CUSTOM CHURCHES INC,46.906715,-98.70825
THE LAMP CHURCH,38.6054,-77.319064
WASHINGTON KOREAN PEACE PRESBYTERIAN CHURCH,38.895047,-77.208227
KLONDYKE CHURCH LLC,38.909256,-77.257816
"KIRKWOOD PRESBYTERIAN CHURCH, INC.",38.782394,-77.230715
KINGDOM WAY CHURCH LLC,38.887298,-77.179402
"LIVING THE WORD KINGDOM CHURCH, INC.",37.042625,-76.399908
KAIROS VA CHURCH,38.740929,-77.20773
"ST. J CHURCH PROPERTY, LLC",37.525485,-77.435794
"LORD JESUS KOREAN CHURCH, INC.",37.50921,-77.585933
IRON CHURCH LLC,38.892166,-77.103079
INTERNATIONAL KINGDOM LIFE CHURCH,37.084506,-76.478411
INVEST CHURCH PLANTING NETWORK,37.711698,-77.481233
LIGHTHOUSE INTERNATIONAL CHURCH (LIC),37.553758,-77.460262
INDO-PAK INTERDENOMINATIONAL CHURCH,38.780498,-77.494071
CHURCHILL MORTGAGE COMPANY,38.299415,-77.463104
HOPE REDEMPTION CHURCH,36.781049,-76.220534
"LAKESIDE PRESBYTERIAN CHURCH OF HENRICO, INC.",37.621235,-77.481982
HAVING CHURCH MINISTRIES LLC,36.87614,-76.423783
HARVEST INTERCONTINENTAL CHURCH - VIRGINIA,38.877569,-77.383528
HAMPTON ROADS CHURCH,36.851324,-76.072356
HARVEST CHURCH OF HAMPTON,36.870514,-76.446867
"GREGORY MEMORIAL PRESBYTERIAN CHURCH, INC.",37.229975,-77.292491
GRACE NEPALI CHURCH,39.01291,-77.418361
"GREATER REFUGE CHURCH MINISTRIES, INC.",37.577171,-77.400279
THE CHURCH OF GOD IN VIRGINIA,37.143166,-80.319192
MOUNT GILEAD CHURCH,37.222414,-76.625064
"FRONT ROYAL CHURCH OF THE NAZARENE, INC.",38.934258,-78.206571
"FREE LIFE CHURCH, INC.",39.080913,-77.555769
FREEDOM CHURCH REVOLUTION,38.648365,-78.671754
FREEDOM LIFE CHURCH,37.675096,-77.453693
"FREEDOM LIFE CHURCH INTERNATIONAL, INC.",37.056237,-76.374566
THE SALISBURY PRESBYTERIAN CHURCH FOUNDATION,37.526574,-77.653014
CHURCH HILL PRESBYTERIAN CHURCH FOUNDATION,37.533929,-77.416317
"FIRST PRESBYTERIAN CHURCH, PULASKI, VIRGINIA, INC.",37.064714,-80.771241
"FIRST PRESBYTERIAN CHURCH OF WINCHESTER, VIRGINIA, INC.",39.182544,-78.165722
UNITY FELLOWSHIP CHURCH LLC,37.264504,-76.664949
REVIVAL FELLOWSHIP CHURCH,38.776984,-77.524577
MOUNTAIN OF HOLINESS FELLOWSHIP CHURCH,37.443372,-77.33842
"THE LANDING PLACE FELLOWSHIP FREE METHODIST CHURCH, INC.",37.113091,-76.532157
CHURCH FARMS LLC,36.640058,-79.145521
TACO ROCK OF FALLS CHURCH LLC,38.896916,-77.073194